{
  "meta": {
    "stages": [
      {
        "ms": 0,
        "name": "probe",
        "status": "done",
        "cost_usd": 0
      },
      {
        "ms": 6618,
        "name": "download",
        "status": "done",
        "cost_usd": 0
      },
      {
        "ms": 30322,
        "name": "transcribe",
        "status": "done",
        "cost_usd": 0.0562,
        "provider": "openai/whisper-1"
      },
      {
        "ms": 18129,
        "name": "clean",
        "model": "gpt-4o-mini",
        "status": "done",
        "cost_usd": 0.0022
      },
      {
        "ms": 23932,
        "name": "digest",
        "model": "map: gpt-4o-mini, reduce: gpt-4.1",
        "status": "done",
        "cost_usd": 0.0328
      },
      {
        "ms": 10595,
        "name": "extras",
        "model": "glossary: gpt-4o-mini, critique: gpt-4.1",
        "status": "done",
        "cost_usd": 0.0135
      },
      {
        "ms": 0,
        "name": "fact_check",
        "status": "skipped",
        "cost_usd": 0
      }
    ],
    "tokens": {
      "in": 19488,
      "out": 7723
    },
    "created_at": "2026-09-06T19:14:56.757Z",
    "finished_at": "2026-09-06T19:16:26.607Z",
    "total_cost_usd": 0.1047
  },
  "digest": {
    "tldr": "Событийно-ориентированная архитектура заменяет модель запрос-ответ обменом событиями через брокер и за счёт этого выигрывает у неё. Подчеркивается высокая масштабируемость, отказоустойчивость и возможность обработки событий в реальном времени. Приводятся примеры использования в крупных компаниях и рассматриваются инструменты RabbitMQ и Kafka. Заключение — событийно-ориентированный подход обеспечивает гибкость и надежность современных систем.",
    "quotes": [
      {
        "text": "Событийно-ориентированная архитектура — это правильный путь к построению Amazon.com, и любой другой способ будет неправильным.",
        "start": 70.1,
        "speaker": null,
        "translation": null
      },
      {
        "text": "Переход на такого вида архитектуру дает множество преимуществ, но в частности можно выделить 4 основных преимущества.",
        "start": 332.5,
        "speaker": null,
        "translation": null
      },
      {
        "text": "RabbitMQ — это продукт с открытым исходным кодом.",
        "start": 455.6,
        "speaker": null,
        "translation": null
      },
      {
        "text": "Событийно-ориентированная архитектура набирает популярность не просто так.",
        "start": 455.6,
        "speaker": null,
        "translation": null
      }
    ],
    "structure": [
      {
        "end": 70.1,
        "start": 0,
        "title": "Вступление канала",
        "summary": "Канал представляет статью о событийно-ориентированной архитектуре и рекомендует образовательную платформу Teach & Study."
      },
      {
        "end": 137,
        "start": 70.1,
        "title": "Преимущества событийно-ориентированной архитектуры для современных компаний",
        "summary": "Компании, такие как Uber и Twitter, используют событийно-ориентированную архитектуру для мгновенного обновления информации и удовлетворения потребностей пользователей."
      },
      {
        "end": 190.9,
        "start": 137,
        "title": "Недостатки традиционной архитектуры запрос-ответ",
        "summary": "Традиционная архитектура запрос-ответ приводит к потерям данных и финансовым рискам при сбоях сервисов."
      },
      {
        "end": 249.3,
        "start": 190.9,
        "title": "Модель публикации и подписки в событийно-ориентированной архитектуре",
        "summary": "Модель публикации и подписки позволяет нескольким сервисам принимать одно и то же событие, обеспечивая гибкость и масштабируемость системы."
      },
      {
        "end": 332.5,
        "start": 249.3,
        "title": "Основные преимущества событийно-ориентированной архитектуры",
        "summary": "Событийно-ориентированная архитектура обеспечивает обработку данных в реальном времени и устойчивость к сбоям."
      },
      {
        "end": 455.6,
        "start": 332.5,
        "title": "Масштабируемость инфраструктуры при событийно-ориентированном подходе",
        "summary": "Архитектура способствует легкому добавлению новых сервисов и масштабированию системы без изменений существующих компонентов."
      },
      {
        "end": 562,
        "start": 455.6,
        "title": "RabbitMQ и Kafka как инструменты событийно-ориентированной архитектуры",
        "summary": "RabbitMQ и Kafka предоставляют необходимые возможности для реализации событийно-ориентированной архитектуры, обеспечивая приоритеты сообщений и высокую производительность."
      }
    ],
    "key_points": [
      {
        "text": "Событийно-ориентированная архитектура позволяет компаниям удовлетворять растущие требования пользователей.",
        "start": 70.1,
        "detail": "Компании, такие как Uber и Twitter, используют эту архитектуру для мгновенного обновления информации, что делает сервисы более отзывчивыми и современными."
      },
      {
        "text": "Традиционная архитектура запрос-ответ имеет узкие места и может привести к потерям при сбоях.",
        "start": 137,
        "detail": "В случае сбоя одного из сервисов запрос клиента теряется, что может привести к значительным финансовым потерям для крупных компаний."
      },
      {
        "text": "Событийно-ориентированная архитектура использует модель публикации и подписки.",
        "start": 190.9,
        "detail": "В этой модели отправитель события (издатель) может уведомлять сразу несколько сервисов, что повышает гибкость и масштабируемость системы."
      },
      {
        "text": "Переход на событийно-ориентированную архитектуру обеспечивает вывод данных в реальном времени и отказоустойчивость.",
        "start": 332.5,
        "detail": "Архитектура позволяет быстро обрабатывать данные, сохранять сообщения в очереди и предотвращать их потерю при сбоях."
      },
      {
        "text": "RabbitMQ и Kafka — ключевые инструменты для реализации событийно-ориентированной архитектуры.",
        "start": 455.6,
        "detail": "RabbitMQ позволяет устанавливать приоритеты сообщений, а Kafka обеспечивает высокую пропускную способность и низкую задержку, что важно для потоковой обработки данных."
      },
      {
        "text": "Событийно-ориентированная архитектура способствует легкой масштабируемости инфраструктуры по мере роста компании.",
        "start": 381.4,
        "detail": "Добавление новых сервисов не требует изменения существующих компонентов, они просто подписываются на нужные события."
      }
    ]
  },
  "extras": {
    "critique": {
      "weak": [
        {
          "claim": "Полагаю, одного этого заявления (Тим Брей) вполне достаточно, чтобы как минимум вызвать интерес к событийно-ориентированной архитектуре.",
          "issue": "Апелляция к авторитету без раскрытия аргументов или примеров, почему мнение одного эксперта должно быть убедительным для зрителя.",
          "start": 70.1
        },
        {
          "claim": "Подобные механизмы удержания гарантируют, что сообщения никогда не будут утеряны.",
          "issue": "Не поясняется, что надежность хранения сообщений зависит от конкретной реализации слоя распределения и его устойчивости к сбоям; не упомянуты возможные точки отказа.",
          "start": 249.3
        },
        {
          "claim": "Этот процесс сериализации делает доставку сообщения чрезвычайно быстрой, и в итоге мы получаем более высокую пропускную способность потоков данных.",
          "issue": "Не приводится сравнения с альтернативами или количественных данных, чтобы показать, насколько быстрее становится доставка сообщений именно из-за сериализации.",
          "start": 332.5
        },
        {
          "claim": "Это значительно упрощает подключение различных микросервисов и сокращает время разработки, и в результате мы получаем более высокую скорость масштабирования.",
          "issue": "Нет примеров или данных, подтверждающих, что время разработки действительно сокращается, и не раскрыты возможные сложности интеграции микросервисов.",
          "start": 381.4
        }
      ],
      "strong": [
        "Видео хорошо объясняет базовый механизм событийно-ориентированной архитектуры через аналогию с почтовой системой, что помогает понять, как сообщения могут быть сохранены и доставлены позже, если потребитель временно недоступен.",
        "В разделе о преимуществах событийно-ориентированной архитектуры четко выделяются четыре ключевых аспекта (вывод в реальном времени, масштабируемость, отказоустойчивость, высокая доступность) и кратко поясняется механизм достижения каждого из них.",
        "Приводится конкретный пример с компаниями Uber, Twitter и LinkedIn, чтобы показать, где и почему востребованы обновления в реальном времени, что иллюстрирует практическую значимость архитектуры.",
        "В заключении признается, что событийно-ориентированная архитектура имеет высокую кривую обучения и сложную первоначальную настройку, что демонстрирует признание ограничений и неидеальности подхода."
      ],
      "missing": [
        "В видео не рассматриваются сценарии, где событийно-ориентированная архитектура может быть избыточной или неэффективной, например, для простых или малонагруженных систем.",
        "Не обсуждаются потенциальные сложности поддержки и отладки распределённых систем, возникающие при переходе на событийно-ориентированную архитектуру.",
        "Отсутствует сравнение с альтернативными архитектурными подходами (например, REST, gRPC, CQRS), что позволило бы лучше понять преимущества и недостатки событийно-ориентированной архитектуры.",
        "Не раскрыты вопросы обеспечения целостности данных и обработки ошибок в асинхронных сценариях, что критично для многих бизнес-приложений.",
        "Не упомянуты способы верификации заявленных преимуществ (например, метрики производительности, реальные кейсы внедрения), что позволило бы зрителю самостоятельно оценить целесообразность перехода."
      ]
    },
    "glossary": [